{
  "schema_version": "net.endpoint.descriptor.v1",
  "endpoint_id": "endpoint_demo_local_ipc",
  "node_id": "node_localhost_service_demo",
  "endpoint_label": "Demo local IPC endpoint",
  "endpoint_kind": "local_ipc",
  "endpoint_scope": "machine",
  "endpoint_state": "declared",
  "endpoint_security": "trusted_local",
  "address_ref": "local-ipc://demo",
  "metadata": {
    "fixture_posture": "local IPC endpoint seed",
    "runtime_behavior": "not implemented"
  },
  "declared_at_unix_ms": 0,
  "capability_refs": [
    "capability_demo_receipt_emit",
    "capability_demo_metrics_stream"
  ]
}
