{
  "schema_version": "net.endpoint.descriptor.v1",
  "endpoint_id": "endpoint_demo_future_transport",
  "node_id": "node_external_demo",
  "endpoint_label": "Demo future transport endpoint",
  "endpoint_kind": "future_transport",
  "endpoint_scope": "external",
  "endpoint_state": "unknown",
  "endpoint_security": "external_untrusted",
  "address_ref": "future-transport://demo",
  "metadata": {
    "fixture_posture": "future transport endpoint seed",
    "runtime_behavior": "not implemented"
  },
  "declared_at_unix_ms": 0,
  "capability_refs": [
    "capability_demo_neural_llm_decode",
    "capability_demo_generic_external"
  ]
}
