{
  "schema_version": "net.endpoint.descriptor.v1",
  "endpoint_id": "endpoint_demo_remote_http",
  "node_id": "node_remote_demo",
  "endpoint_label": "Demo remote HTTP endpoint",
  "endpoint_kind": "remote_http",
  "endpoint_scope": "remote",
  "endpoint_state": "declared",
  "endpoint_security": "declared_remote",
  "address_ref": "remote-http://demo",
  "metadata": {
    "fixture_posture": "remote endpoint seed",
    "runtime_behavior": "not implemented"
  },
  "declared_at_unix_ms": 0,
  "capability_refs": [
    "capability_demo_neural_embedding_encode"
  ]
}
