{
  "schema_version": "net.endpoint.descriptor.v1",
  "endpoint_id": "endpoint_demo_localhost_http",
  "node_id": "node_localhost_service_demo",
  "endpoint_label": "Demo localhost HTTP endpoint",
  "endpoint_kind": "localhost_http",
  "endpoint_scope": "machine",
  "endpoint_state": "declared",
  "endpoint_security": "trusted_local",
  "address_ref": "localhost-http://demo",
  "metadata": {
    "fixture_posture": "localhost endpoint seed",
    "runtime_behavior": "not implemented"
  },
  "declared_at_unix_ms": 0,
  "capability_refs": [
    "capability_demo_receipt_emit"
  ]
}
