{
  "schema_version": "net.endpoint.descriptor.v1",
  "endpoint_id": "endpoint_demo_local_process",
  "node_id": "node_local_process_demo",
  "endpoint_label": "Demo local process endpoint",
  "endpoint_kind": "local_process",
  "endpoint_scope": "process",
  "endpoint_state": "declared",
  "endpoint_security": "local_only",
  "address_ref": "local-process://demo",
  "metadata": {
    "fixture_posture": "local process endpoint seed",
    "runtime_behavior": "not implemented"
  },
  "declared_at_unix_ms": 0,
  "capability_refs": [
    "capability_demo_metrics_stream"
  ]
}
