{
  "schema_version": "net.endpoint.descriptor.v1",
  "endpoint_id": "endpoint_demo_lan_http",
  "node_id": "node_lan_demo",
  "endpoint_label": "Demo LAN HTTP endpoint",
  "endpoint_kind": "lan_http",
  "endpoint_scope": "lan",
  "endpoint_state": "declared",
  "endpoint_security": "declared_remote",
  "address_ref": "lan-http://demo",
  "metadata": {
    "fixture_posture": "LAN endpoint seed",
    "runtime_behavior": "not implemented"
  },
  "declared_at_unix_ms": 0,
  "capability_refs": [
    "capability_demo_generic_external"
  ]
}
